{
  "schema_version": 1,
  "tool": { "name": "gg", "version": "0.3.0" },
  "command": "check",
  "ok": false,
  "summary": { "errors": 1, "warnings": 0, "notes": 0, "suppressed": 0 },
  "diagnostics": [
    {
      "id": "d1",
      "code": "GG0301",
      "rule": "use-after-consume",
      "severity": "error",
      "category": "ownership",
      "message": "`c` was consumed by `finish` and cannot be used afterwards",
      "explanation": "A value passed to a `consume` parameter moves into the callee. The caller no longer owns it.",
      "span": {
        "file": "main.gg",
        "start": { "line": 7, "column": 11, "offset": 106 },
        "end":   { "line": 7, "column": 12, "offset": 107 }
      },
      "labels": [
        {
          "role": "cause",
          "message": "`c` is consumed here",
          "span": {
            "file": "main.gg",
            "start": { "line": 6, "column": 12, "offset": 93 },
            "end":   { "line": 6, "column": 13, "offset": 94 }
          }
        },
        {
          "role": "definition",
          "message": "`finish` takes `c` as `consume`",
          "span": {
            "file": "main.gg",
            "start": { "line": 1, "column": 14, "offset": 13 },
            "end":   { "line": 1, "column": 21, "offset": 20 }
          }
        }
      ],
      "details": {
        "value": "c",
        "state": "consumed",
        "consumed_at": { "line": 6, "column": 12 },
        "used_at": { "line": 7, "column": 11 },
        "callee": "finish",
        "parameter": "c"
      },
      "caused_by": null,
      "fixes": [
        {
          "id": "f1",
          "description": "Make `finish` take `c` as `read` (the default) so the caller keeps ownership",
          "applicability": "likely",
          "verified": true,
          "edits": [
            {
              "file": "main.gg",
              "start": { "line": 1, "column": 14, "offset": 13 },
              "end":   { "line": 1, "column": 22, "offset": 21 },
              "replacement": ""
            }
          ]
        },
        {
          "id": "f2",
          "description": "Use `c` before calling `finish`, or stop using it after the call",
          "applicability": "manual",
          "verified": false,
          "edits": []
        }
      ],
      "doc": "gg explain GG0301"
    }
  ]
}
